,Customer Name,Review title,Rating,Review comment
147,UTPAL ANAND,Terrific,5,"Phone works great except the battery,drains quicker when you are playing high graphics game like fortnite etcREAD MORE"
148,Subhankar Ghosh,Excellent,5,Best camera with best battery I’ve been using since morning but still 70%. Apple really work for the battery this time. Already in love with the productREAD MORE
149,Shivam Mishra,Terrific,5,"The phone is simply phenomenal, I upgraded from my 7 Plus and it was definitely worth it.The battery life is good, the cameras are great. The phone is a bit big if you’re not used to keeping a big phone. I prefer big phones so I feel comfortable around it.Having lena guard is a must. Overall it’s a great phone, you shouldn’t upgrade from X or Xs. Not even tiny bit of difference but if you’re on a phone prior to that, go for it.READ MORE"
150,Vishal B,Wonderful,5,"Although I already bought my first ever Apple product last year (iPad 2018), this is my first iPhone ever. And I love it! I keep seeing people talk about the usual things - the battery, the camera, the display - all that is good but where I think this device knocked it outta the park is it’s performance along with the ease of the iOS 13. Some really zippy work there. Secondly, I like how this syncs up with my iPad all the time, it’s like they’re good mates.Apple Arcade - not too many top g...READ MORE"
151,Navin Singh,Super!,5,"Great Phone, I am using mobile phone since 1999, this one is best in all. Very smooth and powerful, Flipkart is best place to buy. Flipkart sells original Apple Phone and with offers. Thanks Flipkart team.READ MORE"
152,Flipkart Customer,Excellent,5,absolutely stunning phone. Switching from android to ios has been an absolute great experience. Best purchase till date. Kudos to apple.READ MORE
153,Anirban Roy,Perfect product!,5,"I’ll be rather the billionth person to review it. So, let’s save you all from the misery. Delivery experience - I ordered this product on 21st Jan 2020 & the product was shipped on 25th late evening. Received on 28th Jan 2020. Walk into an Imagine store & you’ll get amazing offers there compared to here. Rather Retailers like Reliance Digital might give you additional discounts. On the spot & No Cost EMI too on the card.READ MORE"
154,Rishi Paul,Great product,5,"Have been used for 2 months its quite good but not satisfied with the camera quality, because of the wide angle lens there is too much lens distortion on the edges i will say 7+ has much more better camera quality with crisp images and with very less lens distortion....READ MORE"
155,kiran  velani,Good choice,4,I have my first iPhone I love itusing 15 day very good performance Mobile- 5/4Charging- 5/5Camera- 5/5Battery backup -5/5Display- 5/4Courier facility- 5/0 Very badCourier facility is poor.  I have not happy in courier facility..READ MORE
156,Mandar Dahale,Must buy!,5,just hold it in ur hand and u will be very impressed by its quality. Screen is not full hd but trust me you wont feel it a bit. Very satisfied with purchase.READ MORE
157,vishal khachi,Super!,5,Man man man!!!!!!!This phone is just awesome 😍Let me just tell the Advantages of iPhone 11 •This phone is having 4K video recording. It supports 2160p@24/30/60fps and 1080p@30/60/120/240fps video• Having HDR• It is also having IP68 dust/water-resistant.• Most Important it’s speaker’s it’s just blow your mind awesome👏🏻 • Night Mode is unbeatable although its not you can switch to but it automatically detect when to turn night mode active•Wireless Charging / Fast-charging SupportCON...READ MORE
158,Arun Anson Arouje,Just wow!,5,Amazing product.Had waited for sometime to decide if I should go for the XR or the 11. Landed on this later. The device is just so snappy that i feel like my work moves faster. Recommend for anyone who loves the Apple ecosystem and needs performance.READ MORE
159,Akash Mishra,Pretty good,4,The fresh new iphone in my hands product red. The display is good just like the X or Xs but the selling point here is the camera and it is really good. The battery is really improved and the new chipset give power packed performance. Not a very smart buy if u already have an iphone X or Xs. But look for all the deals and offers and buy it at the minimum price.READ MORE
160,Mohit Pachori,Mind-blowing purchase,5,"awesome phone, value for money. nothing is like iphone 11. i just love it. thanks flipkart for safe and quick delivery.READ MORE"
161,Pradeep Putta,Just wow!,5,"I love this iPhone 11, excellent battery backup, superb camera, performance is all time good in iPhone, because this is iOS. Writing this review after 2 months usage, don’t look back go for it damn sure you satisfied a lotREAD MORE"
162,Flipkart Customer,Excellent,5,Screen is LCD however it is a great looking screen. It is sad that you are spending so much money and not even getting a fast charger. The camera is amazing and os has always been a pleasure to use. Definitely not value for money but the design and quality is certainly amazingREAD MORE
163,Anup Upadhyaya,Mind-blowing purchase,5,The Camera is a beast! Performance super Smooth . Screen Resolution : The screen resolution ain’t so great . Even the cheapest of android phones come with a 1080i display but not the damn iPhone 11. Thats a major setback . The pictures in Instagram and FB don’t look appealing enough until you get used to the 720p resolution .Battery :Decent Back up . Lasts a day with moderate usage . PubG drains out the battery pretty bad .This is my first iOS experience . Loving it!READ MORE
164,Shubham  Nale,Value-for-money,4,I just loved it till now. Everything perfect . Just single star missed coz while in call voice is low . Can’t hear proper . But when connected to earphones it’s perfect .READ MORE
165,Rohit Kumar  Maurya,Delightful,4,awesome phone. nice camera quality and sound. feeling very happy buying this smartphone. But after 4 month it’s right side speaker of earphone not working. Feeling sad.READ MORE
166,Rajib Sarma,Brilliant,5,"This is a gift for my wife. She preferred the green colored iPhone, as it is a new color introduced by Apple.Avid user of IPhones for the last 6 years starting with I phone 5S.She started using the product immediately after we received it & she loving it.Refer to my ratings as per below:Delivery Time: Amazing (3 days)Looks: Awesome. Exactly same as it was shown in the portalValue for money: satisfied. I got an instant discount of Rs 6000/- on the m.r.p (hdfc cards). Definite recommen...READ MORE"
167,Aadil Shaikh,Fabulous!,5,"Simply wow the camera, battery backup, gaming performance, display quality and most of the value for money.... I would recommend this phone to any one who would like to move to the iPhone world. ✌️READ MORE"
168,Prakash Pks,Just wow!,5,"The phone is really super trust me I used apple since iphone 4s and i could say their product is really fantastic beside you can choose note 10 also but for IOS lover iphone 11 will be better,"".READ MORE"
169,Rohan Serrao,Highly recommended,5,upgraded from iPhone 7 and was introduced to a great performance right out of the box .Worth  every penny spend on the premium phone . Great camera especially the night modeREAD MORE
170,Aswini Nellimarla,Best in the market!,5,Wow wonderful gift for the special day from special one. And obvious that Apple phone is always be a wonderful mobile. Looks stunning. Falling in love with its colour and featuresREAD MORE
171,Flipkart Customer,Best in the market!,5,"Great phone, using from last 4 months. No issues till now, good battery backup for 1 day with good usage. Loving this upgrade from iPhone 7, worth the package.READ MORE"
172,Suvam Mondal,Worth every penny,5,"PUBG REVIEWI bought this device for pubg,to play custom tournaments,and earn money..A13 chip is amazing..no lag in customs matches on mobile network..i play on airtel net.sim network..80-90 ms...One thing is battery consumption is 15% per match..xr takes 10% per match..so i hope apple fix this..Sometime during matches it heats a little..then cool down automatic..so heating issue is not a problem..Touch response is way better than android lcd..For gaming it is really beast..but if yo...READ MORE"
173,Abhishek Sachdeva,Worth every penny,5,Feeling awesome after getting the delivery of my phone. Dual speakers makes the sound quality very loud. Amazing!!READ MORE
174,Karunakar kummari,Just wow!,5,Nice productThe camera is extremely good which i liked the most.Got delivery within 24 hrs. Thanks to FlipkartREAD MORE
175,Flipkart Customer,Very Good,4,🎈Battery🎈Performance 🎈Camera🎈Price🎊All together worth IT ♥️♥️♥️♥️READ MORE
176,Thoha P,Terrific purchase,5,Value for money 🖤🖤READ MORE
177,Vijay  Soni,Highly recommended,5,Awesome Best iPhone 😍👍🏼READ MORE
178,Sachin Singh,Best in the market!,5,Superbb performance n camera is awesome 😍😍READ MORE
179,Siddharth Kaushik,Just wow!,5,Upgrade from iPhone 7READ MORE
180,Rohan Chavan,Wonderful,5,Definitely worth purchaseREAD MORE
181,Manoj Jonesraj Vijayan,Just wow!,5,Loving it!!! 🤩SE to 11❤️A Big & Worthy Upgrade🥰💥READ MORE
182,Flipkart Customer,Worth every penny,5,excellent look...READ MORE
183,Atul Pandey,Must buy!,5,Loved it...READ MORE
184,Shivendra Mani ,Great product,5,Purple is bestREAD MORE
185,Mahesh Runkana,Highly recommended,5,I upgraded from 7 plus and Im not regretting it. The only thing missing is OLED display other than that 11 is no where lesser than 11pro.READ MORE
186,SRIKANTH R,Great product,5,Superb Phone..READ MORE
187,Amar Warad,Classy product,5,Just enjoy the power of it!READ MORE
188,Avishek  Mani,Great product,5,"Awesome phone, great display(may not be a OLED)...very fast processor...taking portrait photo is the real joy.READ MORE"
189,vaibhav gupta,Classy product,5,NiceREAD MORE
190,Dev,Terrific purchase,5,Value for money 😍READ MORE
191,vivek singh,Simply awesome,5,over all its nice.. color... purple. 😍READ MORE
192,Flipkart Customer,Excellent,5,"Using this phone from last 4days, great camera quality love itREAD MORE"
193,Md Irfan Ansari,Classy product,5,Outstanding performance this phoneREAD MORE
194,Ajay Rajvadi,Just wow!,5,Product 100%READ MORE
195,Pawan Kumar,Wonderful,5,"If you get it you would definitely not regret it. It is a premium flagship phone. Love for apple, love for iphone.READ MORE"
196,Saiyam Jain,Worth the money,4,"Battery heats every once in a while. Also, while Apple claims that the battery lasts 1 hour more than iphone XR, I personally have tried testing and the hard fact is that it doesnt. Phone’s performance and camera is great. Just that battery life js not very great. Also, no fast charger comes in the box. Charging the phone takes more than 2.5 hours.READ MORE"
197,Rohit Rathor,Wonderful,5,Excellent Fabulous Adorable Iphone 11 Value for money and premium phoneREAD MORE
198,Sathish  Kumar K,Wonderful,5,loved itREAD MORE
199,Rahul ghosh,Good,3,only the name worth it with d price.READ MORE
200,Ganesh  Choudhari ,Fabulous!,5,It’s very good battery life and display and video quality and ther performance of iPhone.....🔥🔥🌈READ MORE
201,Suman Biswas,Highly recommended,5,Best Mobile in the world... after 11pronothing to say...just ..... jst...😍😍😍READ MORE
202,Soumyadeep  Debnath,Awesome,5,Awesome Phone. Battery backup top-notch...READ MORE
203,Prasad  Shedge,Highly recommended,5,Awesome Battery Life...Camera clarity is too good..Value for money...Its gives full day battery backup in single charge...READ MORE
204,Avni Bhat,Wonderful,4,camera is very good.READ MORE
205,Dhiraj Kumar,Brilliant,5,Phone Is So GoodREAD MORE
206,Sachin Barman,Wonderful,5,Amazing!!!iPhone 11 is love.READ MORE
207,Deepak Chandra,Fabulous!,5,Check image quality Camera Performance SuperbDisplay GoodBattery Performance Very GoodiPhone 11 Value For Money ProductOverall AwesomeREAD MORE
208,Rama shankar Sharma,Excellent,5,Awesome...🤩😍😍READ MORE
209,Nitin Todase,Fabulous!,5,iPhone 11 Value for money great productREAD MORE
210,Sagar Chauhan,Simply awesome,5,Nice phoneREAD MORE
211,Munish Kumar,Mind-blowing purchase,5,Nice Quality ProductREAD MORE
212,Amit Singh,Fabulous!,5,Nice imageREAD MORE
213,Rushil Taneja,Super!,5,"Using my first apple product.~Camera is good,getting little use to IOS~Hate the slow 5W charger bundled along Earlier I used Oneplus 6 which used to get charge lighting fast~Camera clicks are too natural, you don’t get any beautification like Vivo oppo or something ~Yes battery drains a lil slow so backup is good ~Screen quality is okay okay but loved the dark mode~Sound quality is really good,it surrounds really properly I would have completely loved the product more if they would ha...READ MORE"
214,Flipkart Customer,Absolute rubbish!,5,don't buy from flipkart...before one day purchased iphone 11 and it found defected after that I request to flipkart for replacement but the are not replace my product...worst flipkart servicesREAD MORE
215,Sudhir Kumar,Wonderful,5,yellow looks amazing and unique color and phone is osmREAD MORE
216,Flipkart Customer,Excellent,5,100% OriginalREAD MORE
217,Kuldeep Singh chouhan,Just wow!,5,Camera battery and it’s overall performance is goodREAD MORE
218,Vikas  Guleria,Worth every penny,5,Excellent phone it’s a pro and value for the money you spent never gonna regret the buying of this phoneSome amazing shots clicked by this iPhoneREAD MORE
219,Nidhin Raphy,Best in the market!,5,"Best Camera, good speakers and I guess green is the best color. Oh..yeah..good battery backup tooREAD MORE"
220,Vijayendra Yadav,Excellent,5,"Amazing, Multi Billion Dollar Deal i got, at Rs 53000/-, I have upgraded from my 6s, i was desperately waiting for this.thanks to flipkartthnks to HDFC.READ MORE"
221,David Chouhan,Excellent,5,Raw power n performance. Perfect choice considering value for money. Definitely one of the best to get. Loving the experience !!READ MORE
222,Abhi Thakur,Worth every penny,5,Really a giant for battery backup and really gaming phone rest all you know very well1st pic During night portraits 2nd pic Ultra wide3rd pic night light4th pic studio light portraitREAD MORE
223,Rubi Modanwal,Terrific purchase,5,Awesome phone...READ MORE
224,Vikram Rajput,Brilliant,5,Best phoneREAD MORE
225,Janardan Paramaguru,Must buy!,5,"Awesome product,no doubt at all*best in delivery process ekartBefore time delivery (48 hours) 👌👌👌READ MORE"
226,Abi,Highly recommended,5,Loving it!!!Great product👌🏻READ MORE
227,Pawan M,Awesome,5,Superb phone .Great battery live and insane performance .I would recommend this phone to any one who would like to move to apple productsREAD MORE
228,M  AYYAPPAN,Worthless,5,Item dead on arrivals not power on i make return on flipkart but they said to go to apple store very much of disappointed .....flipkart team i say one my mobile was go to apple store for replacement if not come you only the response to give new mobile ....READ MORE
229,Suryalata Mohanty,Must buy!,5,ExcellentREAD MORE
230,Gautam Sadana,Super!,5,the things when phone can support 15 ampere chargers for quick charging why bloody apple guys giving 5 ampere charger adapter the old traditional one which is been coming all the way ..if charging good amount why not giving products accordinglyREAD MORE
231,Firoj Khan,Terrific purchase,5,Its amazing phone i ever seenREAD MORE
232,RAMAKRUSHNA BAITHARU,Simply awesome,5,Awesome Thanks FlipkartREAD MORE
233,Ajay Sharma,Fabulous!,5,"Just awesome. No comparison with other phones. Night mode is perfect, Battery backup is perfect. Upgrade from X to 11.READ MORE"
234,Priyanka Singh,Super!,3,Super ncy I love it❤️READ MORE
235,Flipkart Customer,Fair,5,"Android to Ios A13 it's blast performance can be feel, some time lacks in WhatsApp , it's heat frequently at continue use of calling and camera for 5 minutes.. If any one find the solution for heating . kindly add comment in the review...READ MORE"
236,shakir riyaz,Wonderful,5,Finally purchased iphone 11 instead of XR and its awesome decisionREAD MORE
237,dhanraj panoor,Wonderful,4,Value for money ✌️READ MORE
238,Tanvi Mhatre,Brilliant,5,Fantastic phoneREAD MORE
239,Vandana  Kurse,Does the job,3,Apple iPhone as usual is a great product. I can rate out of out. The delivery person from Flipkart first time gave bad experience with rude behaviour .. noPatience at all. He was saying within 10 minutes to be at home but came after 2 hours that too scolding us when we called and enquirers whT time he will come home. Requesting flipkart to appoint customer friendly delivery guys.READ MORE
240,Lakhanraj Kumavat,Terrific purchase,5,Upgraded from iphone 7 n i must say its value for moneyREAD MORE
241,Digvijay karavate,Awesome,5,Everything is accept the charging Speed is fantastic... bought it for 58kREAD MORE
242,Dheeraj,Best in the market!,5,Jus one word “Awesome”READ MORE
243,VIKAS NIKAM ,Must buy!,5,Thanks for flipkart  this mobile is very best. I promise date is is delivery is doneREAD MORE
244,Rahul Chaudhary,Brilliant,5,"I have an iPhone11, and the red variant colour is such a amazing look, the camera quality is superb and the battery performance is awesome.READ MORE"
245,Flipkart Customer,Brilliant,5,"Great phone, super performance, u will have all features of i phone 11 pro 1 lesser camera and lack of qhd screen doesn’t matter will save your more thn 30k Rs. Doesn’t makes a difference than i phone 11 pro just 1 camera less could save your money with all i phone 11 pre look. If u want to save more money i strongly recommend for i phone Xr its not so far than 11 just name sake and look. 1 U have wast of money to burn then go for iphone 11 pro2 U want to save money with complete feel of ...READ MORE"
246,Meerasa F,Utterly Disappointed,5,One of the worst service ever I faced .. flipkart just sent previously activated phone which is not turn on yet .. cheating people .. don't trust flipkartREAD MORE
247,Ravi,Fabulous!,5,Superb battery lifeREAD MORE
248,Omendra Singh,Mind-blowing purchase,4,"Everybody is talking about pros of this phone let me share the negatives.1. Charging this phone takes lifetime. it took my phone 2 hrs to reach from 21% to 74%. 2. Almost same specs design and built quality as XR3. Product Red is basically Lipstick Red, totally different from XR.4. I would rate 0 of 10 in the area of innovation. There is nothing new other than IOS 13 which is full of BUGS. 5. It very heavy around 200 gms and gets heavier if you add cases and covers.READ MORE"
249,Anurag  Varshney,Really Nice,5,The products is good and but apple should give the full hd display and 18 W charger in box that help to  lotREAD MORE
250,Bappa TZ,Super!,5,Exactly mach what you expect and where Spent your money . Pros:1. Battery 10/102. Camera 10/103. Performance 10/104. Premiem Feel 10/105. One handed grip 9/106. Network Capability 9/107. Siri 8/108. App manegement 9/109. Sound on Speaker 8/10Cons:1. Side Panel colour quality 6/102. In-box Charger 6/10READ MORE
251,Rohit Jhawar,Mind-blowing purchase,5,ClassyREAD MORE
252,Mohit Sharma,Terrific,5,amazing product and thanx to flipkart for this 😍😍😘😘😘😘READ MORE
253,Rihanullah Khan,Wonderful,5,Amazing...I am switched Samsung note9 into Iphone 11 one year ago..This phone is amazing...Android ki auqat Iphone use karne ke baad hi pata chalegi!!!!READ MORE
254,Flipkart Customer,Must buy!,3,"Wow, super speed delivery, and i love the product so much... Despite of no stocks in stores and other e-commerce sites, I ordered through Flipkart and i got the delivery next day itself.. 5 stars to Flipkart..READ MORE"
255,Gandhar Bidaye,Excellent,5,Best camera everREAD MORE
256,SANKET SAHU,Must buy!,5,2nd picture describes its night mode with out using flash light the place was totally darkREAD MORE
257,Sunil  Kumar,Perfect product!,5,Lov it best phone in this range highly recommended pls buy the performance of phone is awesomeCamera quality awesomeREAD MORE
258,prince  pratap,Fabulous!,5,"The phone camera is ultimate even in night,Battery backup ,Screen performance, processorbest quality love this❤️READ MORE"
259,Purushottom Dutta,Awesome,5,"The night mode is excellent, this picture is taken at 9:30 PMAnd the performance is amazing.READ MORE"
260,Shakib Ali,Just wow!,5,Value for money. Having a awesome experience with the phone. I am using both XS and this one. Can’t spot much differencesREAD MORE
261,sumer singh,Excellent,5,"Awesome purchse. Its my first apple phone. Before i was using samsung note 8. Camera is stunning with different modes, specially the portrati mode in monochrome. Battery life is good. Performance is buttery smooth. Overall powerhouse phone.  My only concern is apple should introduce file manager or easy file transfer process. Can anybody tell here how to transfer my android whatsapp chat to iphone?READ MORE"
262,ABHINAY KHARE,Classy product,5,Really it's a premium mobile.READ MORE
263,Anuj Kumar,Terrific,5,"It just wow😲, amazing performance, camera, battery and value for money. Love this phone♥️♥️READ MORE"
264,Kamaljeet singh,Simply awesome,5,Best phone ur money can get specially if u want top specs in this pricesREAD MORE
265,Anuj Mavi,Brilliant,5,Amount is to high with out adopters and ear podREAD MORE
266,Piyush Kulkarni,Fabulous!,5,"I was using iPhone 7 before. Now this phone is faster bigger and heavier than 7. Depth is also increased. Now you can surely feel the phone in your pocket and hand due to increased size, weight. Other than that phone is good.READ MORE"
267,Ankush Singh,Wonderful,5,Simply awesome devicePerfect cameraAwesome features.Slow motion recording is just amazing 😍READ MORE
268,Flipkart Customer,Worth every penny,5,"This is the best ever phone u can ever have.I request indian govt to promote Apple in India and boycott xiomi one plus vivo who only copy paste  Say bye bye to one plus ,xiomi ,oppo forever in India. we love Apple only.........READ MORE"
269,Vipul Mangar,Awesome,5,Perfect phone Happy with performance.READ MORE
270,Mukesh Thakor,Super!,5,Good product 👌I love iPhoneREAD MORE
271,Anubhav  Jyoti,Must buy!,5,Superb performance of phone Camera is good Battery is also goodREAD MORE
272,Flipkart Customer,Simply awesome,5,Awesome product 😍😍😍😍READ MORE
273,Flipkart Customer,Mind-blowing purchase,5,"beautiful shining, battery performance is too good.only the draw back is my expectations not meeted front cam but back cam is superb.READ MORE"
274,RAMBABU  SAPA,Wonderful,5,"Good performance, good camera quality and good battery backup, just go for it.READ MORE"
275,Flipkart Customer,Simply awesome,5,Awesome product 😍😍😍😍READ MORE
276,Flipkart Customer,Mind-blowing purchase,5,"beautiful shining, battery performance is too good.only the draw back is my expectations not meeted front cam but back cam is superb.READ MORE"
277,RAMBABU  SAPA,Wonderful,5,"Good performance, good camera quality and good battery backup, just go for it.READ MORE"
278,Harsh Bhatnagar,Brilliant,5,Awesome camera❤️ and gud battery backupREAD MORE
279,Sanket Arak,Best in the market!,5,"Good product. Nothing to complain about. Battery Camera mobile performance is high in all scenarios. Gaming is too smooth using A13 Bionic.Video stabilisation is so smooth, loved it.Attached some shots taken from portrait mode. Worth product if planning to buy an iPhone.READ MORE"
280,pushpender C,Absolutely Awesome device,5,"Apple at its best, this is how you can define this device.Crazily fast performanceGreat CameraGreat BatterySuperfast Face idAwesome looksGood screen qualitySlightly heavy though but doesn't trouble once you get used to it.Thanks Flipkart for a fast delivery.READ MORE"
281,Md Asiful Haque,Really Awesome,5,Apple products though quite expensive still keep itself to the mark.The delivery was completed even before the given date.Complete satisfaction I would say.READ MORE
282,Flipkart Customer,Just wow!,5,buy this product u will never regret... feel h boss😋READ MORE
283,Prateek Sharma,Awesome,5,Nice value for money phoneREAD MORE
284,Noor Punasiya,Mind-blowing purchase,5,"2nd iPhone after iPhone 6 and upgrade from Google Pixel. Simply this is the best phone I have ever had in all aspects. iOS is unbeatable as compared to Android, and Pixel can not compete with this beast at all. Blind Buy... 😁😆 Fully enjoying it.. 🥰🥰😍READ MORE"
285,Mukesh Khanna,Fabulous!,5,Top notch cameraREAD MORE
286,Bala Krish,Classy product,5,Worth every pennyREAD MORE
287,Inderjit Singh,Terrific purchase,5,everything is good about this phone however at 60k customer expect oled display which is lack in this phone.READ MORE
288,Abhishek  Prasad ,Must buy!,5,This phone gives an awesome feeling and confidence.READ MORE
289,Anwani Amit,Very Good,4,Best in class phone battery is not up to mark but not bad also all round phone is best👌👌👌READ MORE
290,Sameer Khan,Absolute rubbish!,5,Don’t buy online camera issue phone not working properly hanging problem please don’t buy from flipkartREAD MORE
291,Chandan K Thakur,Absolute rubbish!,5,"Very Heavy phone. Larger phones are lighterNo comment on Android Vs iOS Delivery speed was very good but delivery guy was rude, flipkart is conpletely unprofessional, Also no option to return.Never buy in Exchange ! They have pre-meditated intent to reduce the price of exchange phone. My phone had no damage, it was in spigen cover and as undamaged as it could be,  still he was showing some imaginary damage and tried to reduce value sonI ended up paying full amount and refused to hand over...READ MORE"
