,Customer Name,Review title,Rating,Review comment
463,Siddharth Dhaka,Highly recommended,5,It got everything you need in a phone Pros - 1 best camera 2 best performance3 best battery lifeCons1 Lcd display could be better2 little bit priceyREAD MORE
464,Mahesh  Rai ,Worth every penny,5,Osm mindblowing phoneREAD MORE
465,Banish Kumar,Super!,5,Thanx to flipkart for really fast delivery and the performance is very goodREAD MORE
466,Anil Singh ,Fair,3,It's a gr8 product but fill need to improve their packagingREAD MORE
467,Kajal Dengta,Wonderful,5,nice got the product within 2 days its awsomeREAD MORE
468,LOKESH MEENA,Must buy!,5,Superb phoneREAD MORE
469,Flipkart Customer,Highly recommended,5,Superb phoneREAD MORE
470,Saikrishna  Gauthu,Brilliant,5,Awesome productREAD MORE
471,Sathiyaraj  P,Very Good,4,OkREAD MORE
472,Vishnu Agarwal,Nice,3,In this price not goodREAD MORE
473,PRATYUSH RANJAN,Perfect product!,5,Superb phoneREAD MORE
474,Datta Patil,Fabulous!,5,NiceREAD MORE
475,Ankit Vijay,Must buy!,5,"Superman delivery by Flipkart even during lockdown, kudos to you guy’s. What else do you expect from Apple flagship, everything is great except for a mediocre yet great display considering price.READ MORE"
476,Flipkart Customer,Super!,5,ONE OF THE SUPERB PHONE I AM USING. ANDROID TO IOS wowwREAD MORE
477,Flipkart Customer,Highly recommended,5,good haiREAD MORE
478,Kevin,Worth every penny,5,Crazy camera and love the phoneREAD MORE
479,Deepak Chandrawanshi,Fabulous!,5,Price is a concern I bought it in 65k although but price would have been around 50k it would have been a great deal . Btw I am very happy with performance and camera output of the 11.READ MORE
480,raja praharaj,Classy product,5,Superbb phoneREAD MORE
481,Vikrant Mahajan,Terrific purchase,5,Good ProductREAD MORE
482,Afzal  Warsi ,Classy product,5,"Origional, rest apple u can unferstand.READ MORE"
483,Aamir Mazhar,Just wow!,5,Best phone i have ever usedREAD MORE
484,Ajay  Sharma,Nice,3,The quality of charger is so poorREAD MORE
485,Vikram rapolu,Just wow!,5,Perfect Product!!READ MORE
486,Genom  Moyong,Highly recommended,5,Super productREAD MORE
487,Ayush  Mishra,Terrific,5,Very good phone♥️READ MORE
488,Bishal Das,Brilliant,5,Really beastREAD MORE
489,Vishnu Agarwal,Nice,3,In this price not goodREAD MORE
490,PRATYUSH RANJAN,Perfect product!,5,Superb phoneREAD MORE
491,Datta Patil,Fabulous!,5,NiceREAD MORE
492,Deepak Chhokar,Really Nice,4,If you have ever used amoled display then you will feel difference in display otherwise everything is great. Heating issue is there when playing pubg.READ MORE
493,Ashutosh Kumar,Highly recommended,5,Nice product as of nowREAD MORE
494,Abhi Abhidhek,Awesome,5,My first iPhone. I have upgraded from Android to iOS . I like the performance of iOS which is value for money.READ MORE
495,Samar Khetrapal ,Highly recommended,5,a superb phone value for moneyREAD MORE
496,Dr Dayanand  Kshirsagar,Must buy!,5,This is my third iPhone.. Flipkart delivered this phone on time as promised.. happy to have this phone...READ MORE
497,Dr william Mattu,Perfect product!,5,This is my first i phone but I'm happy with the ios...though cost is bit higher and put stress on pocket but kts worthyREAD MORE
498,Prabhukumar kc ,Great product,5,Battery backup is very good and lightning fast performance look is excellent value for moneyREAD MORE
499,Sundararajan Masilamani,Classy product,5,"I was reluctant to buy initially because of the display resolution is low.   But when I bought , actually the phone and display looks very good in hand.  Battery is awesome full day at high usage. It is value for money.  Buy it with out a second thought.READ MORE"
500,SWAPNIL BHOSALE,Brilliant,5,I shifted from iphone 6s to iphone 11...its very awesome....no one can match iPhone camera...battery backup is too good...and sound quality is very clear and loudREAD MORE
501,Pranay Kothari,Classy product,5,Overall good. Battery performance is bad.READ MORE
502,Ankita Jain,Fabulous!,5,The product is nice but the delivery was 5 days than the promised date.READ MORE
503,Ankur  Kumar,Must buy!,5,Honestly iPhone X display is far better than Iphone 11. Rest everything is working perfectly fine.READ MORE
504,Jeetendra biswas,Worth every penny,5,I am first te apple user  and 1st day was very confusing but send day easy to use for me and found many type if type function do really want this so i am very glad to buy really like itREAD MORE
505,Kanth P,Must buy!,5,Awesome product from APPLEREAD MORE
506,Venkatesh C,Awesome,5,Nice to go for who loves apple productsREAD MORE
507,Sumit Kumar,Terrific purchase,5,Good phoneREAD MORE
508,Mohammad Talib,Really Nice,4,good but price is too highREAD MORE
509,Deepak Chhokar,Really Nice,4,If you have ever used amoled display then you will feel difference in display otherwise everything is great. Heating issue is there when playing pubg.READ MORE
510,Ashutosh Kumar,Highly recommended,5,Nice product as of nowREAD MORE
511,Abhi Abhidhek,Awesome,5,My first iPhone. I have upgraded from Android to iOS . I like the performance of iOS which is value for money.READ MORE
512,Samar Khetrapal ,Highly recommended,5,a superb phone value for moneyREAD MORE
513,Dr Dayanand  Kshirsagar,Must buy!,5,This is my third iPhone.. Flipkart delivered this phone on time as promised.. happy to have this phone...READ MORE
514,Dr william Mattu,Perfect product!,5,This is my first i phone but I'm happy with the ios...though cost is bit higher and put stress on pocket but kts worthyREAD MORE
515,Prabhukumar kc ,Great product,5,Battery backup is very good and lightning fast performance look is excellent value for moneyREAD MORE
516,Sundararajan Masilamani,Classy product,5,"I was reluctant to buy initially because of the display resolution is low.   But when I bought , actually the phone and display looks very good in hand.  Battery is awesome full day at high usage. It is value for money.  Buy it with out a second thought.READ MORE"
517,SWAPNIL BHOSALE,Brilliant,5,I shifted from iphone 6s to iphone 11...its very awesome....no one can match iPhone camera...battery backup is too good...and sound quality is very clear and loudREAD MORE
518,Pranay Kothari,Classy product,5,Overall good. Battery performance is bad.READ MORE
519,Flipkart Customer,Mind-blowing purchase,5,"What to say, it's apple. There are one plus, Samsung's etc etc. Apple is GOD.everything is.so simple and most important everything works like charm.READ MORE"
520,Flipkart Customer,Perfect product!,5,Apple is my first loveREAD MORE
521,Mohd Adnan ,Just okay,3,Screen quality is not good as compared to iPhone XREAD MORE
522,Parivesh  Chauhan ,Wonderful,5,Good phone all up to brandREAD MORE
523,Aditya Parashar,Terrific,5,Upgraded from iPhone X.It was a worth upgrade!READ MORE
524,Deepak Sharma,Not good,5,Fragile BodyREAD MORE
525,Vishnu P,Just wow!,4,SuperREAD MORE
526,Flipkart Customer,mind blowing,5,"Wataa Phone ,,wata performance ,no words..READ MORE"
527,Dipanka Borah,Best Buy...,5,Performance as expected from any iPhone. Hassle free pickup of my old iPhone. Excellent exchange price compared to Amazon.READ MORE
528,sannith,Terrific purchase,5,Best iphone in this rangeREAD MORE
529,SUSHIL DANVE,Wonderful,5,Value for money productREAD MORE
530,Ravi Patel,Great product,5,I Like this Phone must buy. Fast Delivery Thank you. Flipkart and IPhone.READ MORE
531,pawan singh  dhami,Highly recommended,5,vry nice productREAD MORE
532,Jeswin Kudipudi,Worth every penny,5,No local shops have this device only you flipkart.  ThanksREAD MORE
533,Sagar Chaudhary,Highly recommended,5,I would definitely recommend to buy this phone if you are deciding to purchase iPhone 11 Pro then you are wasting your money because all the things are same . There is only 2 difference between these phone . 1. Display 2. Camera  That’s it . You can’t complain about display when you will use this display lcd display is also a better display and The 3rd camera which is telephoto lens I don’t think so this would be useful because we usually don’t click the picture with the telephoto lens th...READ MORE
534,Raising Star,Best in the market!,5,Photography at its best !! Awesome cameraREAD MORE
535,Kumar Abhay,Super!,5,"A bit let down in display otherwise camera,performance is superb.superb battery life. Someone who prefer to use phone for 2 years without any issues,iphone 11 is the answerREAD MORE"
536,angom singh,Wonderful,5,Overall good I m fine but phone hitting issueREAD MORE
537,Daljeet  Singh,Great product,5,Awsome 👌👌READ MORE
538,Parivesh  Chauhan ,Wonderful,5,Good phone all up to brandREAD MORE
539,Aditya Parashar,Terrific,5,Upgraded from iPhone X.It was a worth upgrade!READ MORE
540,Vishnu P,Just wow!,5,SuperREAD MORE
541,Flipkart Customer,mind blowing,4,"Wataa Phone ,,wata performance ,no words..READ MORE"
542,Dipanka Borah,Best Buy...,5,Performance as expected from any iPhone. Hassle free pickup of my old iPhone. Excellent exchange price compared to Amazon.READ MORE
543,sannith,Terrific purchase,5,Best iphone in this rangeREAD MORE
544,SUSHIL DANVE,Wonderful,5,Value for money productREAD MORE
545,Ravi Patel,Great product,5,I Like this Phone must buy. Fast Delivery Thank you. Flipkart and IPhone.READ MORE
546,Vikram Roy,Mind-blowing purchase,5,Nice phoneREAD MORE
547,Naveen  Reddy,Good choice,4,GoodREAD MORE
548,My Account,Simply awesome,5,Nice product thank you flip cart for feast deliveryREAD MORE
549,Altap Hossain,Wonderful,5,Very fineREAD MORE
550,Flipkart Customer,Best in the market!,5,"Good buy, battery would have been better . But performance of phone is top class.READ MORE"
551,ATUL JHA,Just wow!,5,Camera 5/5Performance 5/5Looks 5/5Battery backup 5/5Everything perfect and as per my expectations Slow charging is a minus hereREAD MORE
552,Dhiraj Singh,Terrific purchase,5,Awesome Phone😍😍READ MORE
553,venkatesh kumar,Terrific purchase,5,GoodREAD MORE
554,Manipal Reddy ,Terrific purchase,5,"Good camera , performance and design . Best phone from apple.READ MORE"
555,sukumar poornachandrarao  tripuraneni,Classy product,5,Great phone but cost is too high don’t know when it will decrease please decrease costREAD MORE
556,Atif Momin,Wonderful,4,"Iphone is top of the world,but flipkart delivery timing is worstREAD MORE"
557,Flipkart Customer,Perfect product!,5,I love love love this phone. Looks and feels so premium. All the apps and features are so coolREAD MORE
558,Yogesh S,Simply awesome,5,i phone no commentREAD MORE
559,Vishal Vikram Singh,Brilliant,5,I phone is always goodREAD MORE
560,divakar,Fabulous!,5,"It's Genuine Original Product.No issues since now ,Night mode is awesomeREAD MORE"
561,abhishek rawat,Terrific,5,"Been using for a week now. upgraded from 6. so for me it's a delight. performance is as others have mentioned, great. i think it's a tad bit thicker and bulkier, not what i had in mind. also it weights quite a bit. though i don't mind the weight part but it is a big phone. i don't find the screen too be a downside , i am using a phone with Amoled display and i can't much find a difference, but then ""difference"" is a subjective term. selfie camera seems a bit blurry but overall great. try cons...READ MORE"
562,Flipkart Customer,Delightful,4,"great display ,awasome camera ,better battery life,over all value for money.READ MORE"
563,Momalia Dey,Classy product,5,lovelyREAD MORE
564,Nikhil  Singh,Super!,5,Upgraded from iPhone 7READ MORE
565,Tomvictor Vithayathil,Perfect product!,5,"Must buy, this will change your personality and lifestyle.I brought it with HDFC credit card for 64k(128gb)Only minor issue is the cropping of videos in full screen.I will give 9/10.READ MORE"
566,SURAJ SUTRADHAR,Mind-blowing purchase,5,great cameraterrific battery lifelower priceREAD MORE
567,Anubhav  sharma,Terrific purchase,5,hello buyers dont think so much jdt go for it it is the best smartphone .The sound quility is super too and all the quility u can expect by its name only❤️READ MORE
568,premnath k,Mind-blowing purchase,5,I have been using this phone almost a week. Using 2 connection. The Battery back on this phone really good. No need to give the comments regarding camera photos.Some snap taken from iphone 11 Just amazing.READ MORE
569,Urgyen Teee,Brilliant,5,original device received and thanks flipkart for on time dileveryREAD MORE
570,Baling  Ratan,Simply awesome,5,okREAD MORE
571,Mantu Kushwaha,Wonderful,4,awesome camera. But display is not upto mark.READ MORE
572,Akash  Shahi,Mind-blowing purchase,5,The iphone 11 white color its to good and looking awesome and royalREAD MORE
573,Flipkart Customer,Terrific,5,SupperREAD MORE
574,Hari,Great product,5,"Performance is lit.. with good battery life and great camera,brings absolute value for money.READ MORE"
575,Shweta  Singh,Decent product,3,nicREAD MORE
576,Karan Dame,Terrific purchase,5,Just some minor issues in network otherwise it it the sexiest gadget i have ever usedREAD MORE
577,ravi Sanghai,Decent product,3,is this purchase under hdfc smart buy or not raviREAD MORE
578,Jovial Tereza,Good,3,Value of money 💰.READ MORE
579,ali  sultan,Wonderful,5,Amazing phone but need more specificationsREAD MORE
580,Flipkart Customer,Terrific purchase,5,amazing phone 😍❤READ MORE
581,Rajan Chauhan,Great product,5,Thanks apple and thanks to FlipkartREAD MORE
582,safaljeet singh,Perfect product!,5,Phone is good. Best iphone mobile till date.READ MORE
583,SIVARAMAKRISHNAN KARUNAKARAN,Terrific purchase,5,Good picture quality in low light conditions . And LCD retina display is not too cheap still it is holding good ..READ MORE
584,Rajib Banerji,Classy product,5,Every year Apple products get better & this iPhone is no exception.READ MORE
585,Prayaas Bhagat,Fabulous!,5,Amazing phoneREAD MORE
586,Flipkart Customer,Good quality product,4,bought it for 64000. very smooth and fast. feels fantastic.READ MORE
587,Flipkart Customer,Excellent,5,Must buyREAD MORE
588,Mudassir khan,Awesome,5,Very nice and camera is awesomeProsCamera Performance Battery Value for money ConsDisplayBezelsREAD MORE
589,Pavan GR,Worth the money,4,"This iPhone 11 is very good, I strongly recommend to buy this one. Specially who are tired with android.READ MORE"
590,Vicky Kumar,Must buy!,5,thanks Flipkart for delivering on time..Price is high but its worth it...READ MORE
591,Dhiren Kumar Mahanta,Worth every penny,5,Front Camera & Mobile heating issue need to be improved. Mobile Dial & Call functions are not handy. Other are as usual. AwesomeREAD MORE
592,Buddhadev Chakraborty,Awesome,5,very awesome productREAD MORE
593,Flipkart Customer,Must buy!,5,Best phone to start new life with iPhoneREAD MORE
594,Venkatesh K,Perfect product!,5,Worth buying itREAD MORE
595,Azharullah Khan,Great phone ever!,5,"This iPhone 11 is awesome for everything if you are using a camera, audio, durability, premium, battery, and do more.READ MORE"
596,Flipkart Customer,Fabulous!,5,"I switched over from iPhone 5s , there is a big change in battery charge, the camera is awesome, the Face ID verification is happening in a second nice feel 👌READ MORE"
597,Kamalpreet Singh,Best in the market!,5,"Superb device , and I m not biased towards appleREAD MORE"
598,Flipkart Customer,Great product,5,Very good mobile... excellent camera and very stylishREAD MORE
599,Avadh Rathod,Nice product,4,This is the cheapest-latest iPhone available and it does come with a stellar camera.Pros:CameraBatteryProcessor Cons:Display Stock charger that comes in the boxLack of headphone jackIt’s a considerable option for those who want to hold onto their smartphone a little while longer. 3 years to go for and four years to go with a bettery replacement considered.READ MORE
600,Abhinash Mohapatra,Really Nice,4,"overall happy with my purchase. it's a beast in its class,and the camera is superb In taking portrait pic.overall value purchasedREAD MORE"
601,Rahul Shah ,Just wow!,5,good quality productREAD MORE
602,Jaya Hariharan,Awesome,5,Close your eyes and order. This product is worth every penny! Awesome and safe delivery by Flipkart. Excellent!!READ MORE
603,MD MOZAMMIL ANSARI,Worth every penny,5,"Yes, Iphone quality look, performance is awesomeREAD MORE"
604,Flipkart Customer,Just wow!,5,value for moneyREAD MORE
605,Anup Kumar,Super!,5,Really feel the power and performance it has. Love with the phone 🥰READ MORE
606,Flipkart Customer,Super!,5,This is unbelievable!! Waat a phone great !!READ MORE
607,Vicky Kumar,Must buy!,5,thanks Flipkart for delivering on time..Price is high but its worth it...READ MORE
608,Dhiren Kumar Mahanta,Worth every penny,5,Front Camera & Mobile heating issue need to be improved. Mobile Dial & Call functions are not handy. Other are as usual. AwesomeREAD MORE
609,Buddhadev Chakraborty,Awesome,5,very awesome productREAD MORE
610,Satyajit Rajput,Very disappointed,5,"Very Bad Quality.. Shutdown and Switch On takes longer time, Charging is slow.. , Network drops very often compare to my old iPhone..  No innovation of Apple even after 5 Years, it is same as iPhone 6 Phones..READ MORE"
611,Rahul Burangi,Expected a better product,4,Paying so much money for LCD IPS display. Apple is playing with customers. The icons of the phone are so big and bad that I remeber my old mobile which I bought 8 years back. Too expensive for these configurations.READ MORE
612,Pramod Sonavane,Utterly Disappointed,4,Phone is heating up during charging also sometimes during normal browsing..just 5 days use till nowAwaiting revertREAD MORE
613,Sameer Singh,Mind-blowing purchase,5,Better than any android phone in the market. Great LCD display. 326 ppi is just a number. Very minor difference between 11 pro and 11.READ MORE
614,Mallikarjun  Pitla,Not good,5,Over hyped product. Iphone Xs and XS Max are still way better than this phone.READ MORE
615,darshan tambe,Pretty good,4,It has nice camera and specs and it is value for money for Apple loyal usersREAD MORE
616,Dev,Terrific purchase,5,Value for money 😍READ MORE
617,Flipkart Customer,Excellent,5,"Using this phone from last 4days, great camera quality love itREAD MORE"
618,vinay ganachari,Absolute rubbish!,3,The worst display and camera. I have compared with oneplus 8 ... Oneplus 8 just beat in all specs. And seriously lcd display is worstREAD MORE
619,Amitava Dey,Unbiased Review,5,"I am basically a Samsung S series user. As an app developer, I always wanted to buy an iPhone. Bought this iphone 11. This phone is just a piece of metal.  I don't like holding this cold piece of metal on my hand. With or without a back cover this phone is too bulky. Not sure which metal they used to build it, it feels heavy. My Samsung s9 is way better then this. Sorry iPhone, I can't use it daily. I'll use it occasionally, just to show off.READ MORE"
620,Monika  Sharma,Did not meet expectations,5,It’s the worst product. I should have bought some android. It’s battery keeps on finishing without even use. Don’t buy it at all. Major battery issueREAD MORE
621,Flipkart Customer,Terrific purchase,4,superb and nice phone thanks for FlipkartREAD MORE
622,Pramod Sonavane,Utterly Disappointed,5,Phone is heating up during charging also sometimes during normal browsing..just 5 days use till nowAwaiting revertREAD MORE
623,Sameer Singh,Mind-blowing purchase,4,Better than any android phone in the market. Great LCD display. 326 ppi is just a number. Very minor difference between 11 pro and 11.READ MORE
624,Mallikarjun  Pitla,Not good,4,Over hyped product. Iphone Xs and XS Max are still way better than this phone.READ MORE
625,Deepak Choudhary,Horrible,5,worst product.  very bad camera quality and screen... look is not attractive.READ MORE
626,Kamal  Kishore ,Worth the money,5,Working smoothly while playing pubgAnd overall performance is excellent but display shuold have at least full HD resolution only thing to do compromise with But when compared to one Chinese brand’s mobile which have full hd + amoled display there was nothing big difference between both of themREAD MORE
627,Flipkart Customer,Worth the money,4,Camera is just wow 👌👌READ MORE
628,Amitava Dey,Unbiased Review,3,"I am basically a Samsung S series user. As an app developer, I always wanted to buy an iPhone. Bought this iphone 11. This phone is just a piece of metal.  I don't like holding this cold piece of metal on my hand. With or without a back cover this phone is too bulky. Not sure which metal they used to build it, it feels heavy. My Samsung s9 is way better then this. Sorry iPhone, I can't use it daily. I'll use it occasionally, just to show off.READ MORE"
629,Monika  Sharma,Did not meet expectations,5,It’s the worst product. I should have bought some android. It’s battery keeps on finishing without even use. Don’t buy it at all. Major battery issueREAD MORE
630,Flipkart Customer,Terrific purchase,4,superb and nice phone thanks for FlipkartREAD MORE
631,Flipkart Customer,Waste of money!,5,Not so much different from iPhone XRREAD MORE
632,Anand L,Good quality product,5,Happy with : Face unlock : Battery performance : 4G NW performance UnHappy with: Camera compared to other phones : Siri mall function iOS issue : Display contrast! Not up to the Samsung : Performance okayWe don’t feel any difference if you come from iPhone 😂😂😂 Better don’t upgrade if you already having iPhone(trust me) not worth 😅READ MORE
633,Anup  Kumar ,Simply awesome,4,This is my first iOS phone.I'm so happy with this product and Camera quality is superb..I love this phone. THANKS FLIPKART.READ MORE
634,Rahul  Pundir,Must buy!,5,Good phone but not handy. You will always need both of your hands to use the phone.READ MORE
635,Harjit Singh,Awesome,5,Very nice phoneREAD MORE
636,BRAJESH SINGH,Highly recommended,5,Osm Apple hai BhaiREAD MORE
637,Akash Kulthia,Excellent,5,The Phone is amazing. Best on design and performanceREAD MORE
638,Sulaiman Kutty,Terrific,5,"Superb , very nice thank you FlipkartREAD MORE"
639,Prince  Pawan,Just wow!,5,Good till nowREAD MORE
640,Eliyas Khan,Best in the market!,5,Awesome phoneREAD MORE
641,Flipkart Customer,Absolute rubbish!,5,faulty phoneworst experienceREAD MORE
642,SYED MUBARAK,Expected a better product,5,But I wanted White colourREAD MORE
643,Aman Soni,Terrific,5,Amazing...!!!READ MORE
644,Rahul Chaudhary,Terrific,5,Finally Purchase My Second iPhone 11 Black Edition Love This Phone Thanks #apple❤️😍#iPhone11READ MORE
645,Deepshikha Thakur,Useless product,5,Heating issue. not a good product. Not satisfiedREAD MORE
646,Flipkart Customer,Not good,5,It’s not a good product don’t buy onlineREAD MORE
647,Flipkart Customer,Could be way better,5,Display is worse qualityREAD MORE
648,Jatin Bachchani,Hated it!,4,big misktake buying this phone onlineREAD MORE
649,TIRUPATI DJ,Good choice,5,as u all now iPhone is killer phone it's come with new ideas looks i have one request to owner plzz give a gud battery life battery comes 5000mh like that it's sounds cool when we talking on iPhoneREAD MORE
650,RR k,Terrific purchase,5,Mind blowing camera performance true flagship and Premium Quality Apple products Thanks FlipkartREAD MORE
651,Nil kamal,Super!,3,Awesome Red colourSuperb IPhone 11I love iPhoneREAD MORE
652,Flipkart Customer,Nice,5,battery back up is not much good . however eyerything is fine.READ MORE
653,Mallikarjun Tolnur,Wonderful,5,Super!best part is camera & screen touch. Overall good to ahead.READ MORE
654,Anand  Singh Nanhe ,Highly recommended,5,I m so happy...READ MORE
655,Shailesh Yadav,Just wow!,5,"There is no heating issue while using 5w charger. It does heats up a little while using 18w charger, but it doesn’t get as heated as OnePlus or other android devices(have been using OnePlus for 3 years). Image quality and video stabilisation is best in market.READ MORE"
656,Flipkart Customer,Highly recommended,5,Good Camera QualityBattery Life is so good in compare to my old iphone6sREAD MORE
657,Vinay Kumar,Fabulous!,5,Good productREAD MORE
658,John Yelugundi,Brilliant,5,Received the delivery right on time as promised. I have made a pre-booking through Flipkart and received it just after 2 days of its launch. Loving the performance of the phone and the camera.READ MORE
659,Flipkart Customer,Moderate,5,"I brought this product for it brand value and camera, but i am very disappointed . The quality of camera is highly disappointing, photos are blur when we zoom them. I have use iphone 7 but the quality of camera and processor is very good.But the same i didnt got it in iphone 11.Its not worth for money if you are only looking for better camera.READ MORE"
660,Kalpesh Daraji,Expected a better product,5,camara result not good very bad resultsthis is korian fon i feel cheatREAD MORE
661,Shahwaz Ahmad,Highly recommended,5,Best mobile in Apple this price range camera is amazing and battery life is very bad but overall good mobile phone.😋READ MORE
662,Dhirodatta Paul,Best in the market!,5,"Who checks review of iPhone. Dude if you are....you've been living under a rock. IPhone 11 is the best deal in the coming few years because next year onwards there would be AMOLED only display. And as you might know AMOLED tech has burnt pixel issue for long usage. So either get this or wait for MicroLED to become mainstream in 4-5 years least. And the mind blowing battery life, is simply out of the world in current market, let alone A13 Bionic.READ MORE"
663,praval purwar,Mind-blowing purchase,5,"best mobile i ever used ,best xamera,READ MORE"
664,Amit Kumar,Best in the market!,5,Value for money product & better then android.READ MORE
665,Mukul Jain,Not good,5,Switch to Android of Same priceREAD MORE
666,Istihak Shaikh,Bad quality,5,OkREAD MORE
