,Customer Name,Review title,Rating,Review comment
1188,Flipkart Customer,Wonderful,4,Awesome phoneREAD MORE
1189,shivaji pawar,Don't waste your money,5,Worst phone don't tryREAD MORE
1190,Akash  Shahi,Best in the market!,5,Awesome game phoneREAD MORE
1191,Prashanth,Excellent,5,Worth!READ MORE
1192,Flipkart Customer,Great product,5,Brand itself says everything you don’t need to write.READ MORE
1193,Sunny Ravinuthala,Terrific,5,Awesome phoneREAD MORE
1194,M K singh,Terrific purchase,5,Camera is brilliant and one day full battery performanceREAD MORE
1195,Aarti M,Terrific,5,Must buy❤️ worth for moneyREAD MORE
1196,Prakhar Taparia,Fabulous!,5,Amazing performance and features. Loved it!!READ MORE
1197,Nagendra Singh,Awesome,5,Nice productREAD MORE
1198,Akash  Dash,Decent product,3,Everything is fine but the phone and the charger is getting heated up really fastREAD MORE
1199,Visakh Shaji,Terrific purchase,5,Awesome product and very good camera ...👍🏼👍🏼READ MORE
1200,Sunil Harchand,Highly recommended,5,awesome phoneREAD MORE
1201,Lalith Sai,Highly recommended,5,I really loved the camera performanceREAD MORE
1202,Rakesh Patel,Terrific,5,Awesome phoneREAD MORE
1203,Sivasanka Rajarapu,Super!,5,Worth for ur money...Don’t listen to any negative comments...Trust worthy smart phoneREAD MORE
1204,Deepak Ranjan Bhola,Classy product,5,Excellent.Because nobody reads a review before buying iPhone.READ MORE
1205,Flipkart Customer,Best in the market!,5,Very good must haiREAD MORE
1206,chitranshu singh,Mind-blowing purchase,5,GoodREAD MORE
1207,Mayur Raiyani,Must buy!,5,It’s incredible phone performance is very high and IOS just amazing loved very muchREAD MORE
1208,Rekha  Pawar,Good choice,4,It’s amazing phone with great performance.READ MORE
1209,Shahab ahmed,Mind-blowing purchase,5,Good mobileREAD MORE
1210,Aswin P,Brilliant,5,Nice productREAD MORE
1211,Partha Dey,Must buy!,5,It’s awesome phoneREAD MORE
1212,Nirmal singh cheema,Terrific,5,5 star because of camera quality. But some time restart automatically because of heavy data. so need ram at least 6 gp.READ MORE
1213,Flipkart Customer,Mind-blowing purchase,5,Awesome phone from Apple and full fancy ColourREAD MORE
1214,V.J.Ramakrushna,Perfect product!,5,Good One..READ MORE
1215,Victor Sirigiri,Just wow!,5,Very GoodREAD MORE
1216,Sagar  Keluskar,Worst experience ever!,5,Unsatisfied with the productREAD MORE
1217,Flipkart Customer,Worth every penny,5,Good product and also battery performance is to good or value for money tooREAD MORE
1218,Flipkart Customer,Mind-blowing purchase,5,Awesome experience with iPhone 11READ MORE
1219,Ritik Gupta,Really Nice,4,Specifications tells that its a dual sim product.. but I am not getting dual sim slotREAD MORE
1220,Flipkart Customer,Best in the market!,5,"Awesome using IPHONE 11, It’s works great and battery Backup is Very good...READ MORE"
1221,Dinesh G,Super!,5,An Awesome phone with the best in class camera and experience.Red is the colour!!!!!!!READ MORE
1222,Ravindra  Dabhadiya ,Decent product,3,S20 batterREAD MORE
1223,Suresh Babu,Perfect product!,5,No one can match with AppleREAD MORE
1224,Saandy  Sinha,Fabulous!,5,AmazingREAD MORE
1225,Dinesh Meena,Highly recommended,5,I love thisREAD MORE
1226,J. Ashis Ranjan Jena,Must buy!,5,"Love at first, second, third, fourth, fifth and sixth sightREAD MORE"
1227,Pintu Padhiary,Fabulous!,5,AwesomeREAD MORE
1228,Bikash  Lenka ,Great product,5,In iphone series...... This phone is value for money 🤘READ MORE
1229,Flipkart Customer,Just okay,3,Just ok..not so grratREAD MORE
1230,Flipkart Customer,Perfect product!,5,Good just that backing up WhatsApp is a messREAD MORE
1231,Anver Haroon,Worth the money,4,Performance is goodREAD MORE
1232,Divakar Shetty,Moderate,5,getting heated up too fast.READ MORE
1233,Haider Ali,Highly recommended,3,GoodREAD MORE
1234,Harish K,Decent product,4,I have received product on time delivery but there is some damaging in the product which is edges are not finishing properly. I have disappointed from Flipkart/Apple.READ MORE
1235,Suhail Ahmed,Nice product,5,Good one loved it ♥️READ MORE
1236,Flipkart Customer,Nice,3,Charging wire too slow or hard I think it's not a genuine very sad.READ MORE
1237,SAHIL  BHANDARI,Fabulous!,5,Just fantasticREAD MORE
1238,Flipkart Customer,Very poor,5,Phone is getting heated frequently while using Fb and other appsREAD MORE
1239,Flipkart Customer,Perfect product!,5,V nice phone must buyREAD MORE
1240,harshal Kanade,Brilliant,5,Awesome performance was not expecting this big of a change in battery performance last a whole day ..READ MORE
1241,Shuvankar Mondal,Terrific,5,Fantastic phone having a bunch of advanced features.Camera quality is awesome and sound is just mindblowing.READ MORE
1242,Chandrasekar Periyasamy,Classy Product,5,Beautiful and very classy phone. Features are superb. I feel worth buying itREAD MORE
1243,Chiranjiv  Rout,Wonderful,5,Phone is awesome but still screen size need to be little large.camera nd processing are very good.READ MORE
1244,Harish D H,Classy product,5,Fastest delivery from Flipkart!Many thanks.READ MORE
1245,anshu shukla,Perfect product!,5,"as usual iPhpne is a brand, working fine. Its awesomeREAD MORE"
1246,Rohit,Simply awesome,5,Brilliant niceREAD MORE
1247,Avinash ,Just wow!,5,this is one of the best iphone I have ever used....it has got one of the best camera....READ MORE
1248,Ayush Ayaan,Great product,5,"This is my first iphone, its a great phoneAnd the delivery service is great.I love appleREAD MORE"
1249,Flipkart Customer,Simply awesome,5,One of the Best iphone in 2020READ MORE
1250,Amandeep  Singh,Highly recommended,5,Apple is always good when it comes to performanceREAD MORE
1251,Flipkart Customer,Simply awesome,5,iPhone as always is a superb productREAD MORE
1252,Harshit Mishra,Simply awesome,5,Flipkart op nd for device no words to explain just go for it if u are a pubg nd camer lover!!😗🔥😋READ MORE
1253,Flipkart Customer,Wonderful,4,Perfect mobile phone.READ MORE
1254,Gurpreet Singh,Really Nice,4,NiceREAD MORE
1255,Asif Saifi,Mind-blowing purchase,5,ExcellentREAD MORE
1256,Manash Jyoti Chutia,Best in the market!,5,I upgraded from iPhone 7 to iPhone 11. This is the best iPhone made till date. But expensive as India’s imposes way to much tax on this compared to other countries. Duel sim feature saved me finally from carrying two phones. Battery is great. Older iPhone users may not believe it. But it is true. 😃😃😃READ MORE
1257,Flipkart Customer,Highly recommended,5,"Excellent Mobile Phone From Apple, Only The charging time is very High(3 hour), Apple should give a First Charger l.READ MORE"
1258,Sunil Verma,Very poor,4,iphone is deadREAD MORE
1259,Pratiraj Patil,Very Good,5,Packing was not secured.READ MORE
1260,Abhishek Panchal,Super!,5,iPhone is bestREAD MORE
1261,Himanshi Jain,Best in the market!,5,It meets all my expectations.READ MORE
1262,arpit dubey,Best in the market!,5,very good performance but prices are very high.i think in less budget many other phones will give u same performanceREAD MORE
1263,Gagan ArYan,Must buy!,5,Iphone 11 is good experience to use this one not go to iphone 11 pro. This is better optionREAD MORE
1264,Hibjur Rahman,Perfect product!,5,good service fast delivery original productREAD MORE
1265,Navi Singh,Brilliant,5,Nce. ....READ MORE
1266,nishant nagori,Fabulous!,5,go for it👍READ MORE
1267,Asheesh  Kumar,Perfect product!,5,Just one word Awesome!READ MORE
1268,Flipkart Customer,Highly recommended,5,I am android user but iPhone use in past Time Good response iPhone 11 camera quality is best battery quality is normal and other features are excellentREAD MORE
1269,Jatin Hooda,Classy product,5,Super fast delivery by flipkart i.e. within 24 hrs. Phone is super awesome.READ MORE
1270,Surinder  Bhullar,Classy product,5,Thanks flipkartREAD MORE
1271,SABIR AHAMMED ,Wonderful,4,Phone is good but...sim port in not openREAD MORE
1272,Subodh Raj,Worth every penny,5,Flipkart made me happy 😊READ MORE
1273,Tahseen Raza,Wonderful,5,Kind of goodREAD MORE
1274,Sneha Behera,Worst experience ever!,5,Phone display got stuck with iPhone logo while installing. Didn't expect this. Unable to do power on. There is no replacement option also.READ MORE
1275,Vijay Dehariya,Brilliant,5,Good oneREAD MORE
1276,gurmeet  kaur,Fabulous!,5,Best phoneREAD MORE
1277,amol badgujar,Simply awesome,3,Nice i loved iphoneREAD MORE
1278,Vysakh Namboothiri,Just okay,5,Phone is amazing. Less stars for flipkart poor delivery policies.READ MORE
1279,Bala,Mind-blowing purchase,5,It's awesome...READ MORE
1280,Flipkart Customer,Classy product,3,Good phoneREAD MORE
1281,Pradeep Banka,Fair,5,It takes a lot of time to charge the battery unlike many other android phones which come with turbo charging functionalityREAD MORE
1282,Rishabh Agrawal,Wonderful,5,Great product by appleREAD MORE
1283,Sai Prasad Chinnu,Fabulous!,5,good oneREAD MORE
1284,Flipkart Customer,Fabulous!,5,Nice one❤️READ MORE
1285,Nischal Rajoria,Highly recommended,5,Great and awesome phoneREAD MORE
1286,Flipkart Customer,Terrific purchase,5,Best iphone everREAD MORE
1287,Ajay Bhadouria,Brilliant,5,Best phone..READ MORE
1288,Abhishek Takodara,Terrific,5,SuperREAD MORE
1289,purshottam dunna,Excellent,5,Loved it ❤️READ MORE
1290,Flipkart Customer,Terrific,5,Proud to be d owner of iphone AwesomeREAD MORE
1291,Nibedan banerjee,Fabulous!,5,No problems at all ! Great buyREAD MORE
1292,Vipin Kumar Gusain,Must buy!,5,best iphone in this year. no lags. outstanding performance. battery not up to the mark. in opinion give me 16 hours backupREAD MORE
1293,Arup Das,Must buy!,5,Awesome phoneREAD MORE
1294,Sachin Swami,Excellent,5,No words superlative iPhone 11READ MORE
1295,Sudeep Pramanik,Super!,5,"One of the best iPhones I could wish to hold on too!!!Best camera ,best performance and my favourite is the monster battery!!!Loved it...READ MORE"
1296,Flipkart Customer,Great product,5,Ooooo nice lookingREAD MORE
1297,YS,Fabulous!,5,"awesome product, original. super fast deliveryREAD MORE"
1298,Rohit Tipshetti,Great product,5,Amazing phone..I’m totally satisfied 5* for sound effects 5* for camera 5* for graphicsREAD MORE
1299,Sandy SA,Awesome,5,Best in dis range of any other brandREAD MORE
1300,Flipkart Customer,Terrific purchase,5,AwesomeREAD MORE
1301,RaghuRaman Soundararajan,Highly recommended,5,1. Very smooth to use what I expectI satisfied what i expectREAD MORE
1302,Soyab Mirza,Highly recommended,5,superbbbb nice mobile iphone 11 ✌READ MORE
1303,Prabhjot Luthra,Wonderful,5,Good...go for itREAD MORE
1304,Flipkart Customer,Best in the market!,5,Amazing phone !!!READ MORE
1305,RAKTIM BANIK,Simply awesome,5,"Fully Satisfied, Just a Suggestion If You Want to Buy for Gaming Only You Can Think Another Phone as PUBG with Low Settings Can be Played Continuously for Maximum 3hr 30Mins Without charging, As a 30 Minute Pubg Match Takes almost 15% of Battery with Moderate Heating. Expect this Other Doesn’t Stand a Chance in Any Competition in Any Category!READ MORE"
1306,Avinash Chowdary,Just wow!,5,Apple user from past 10 yearsREAD MORE
1307,Amaresh Sahu,Best in the market!,5,Excellent product and fastest delivery .READ MORE
1308,Prashant Singh,Excellent,5,Awesome phone. value for money.READ MORE
1309,Moabbid Mansuri,Best in the market!,5,NiceREAD MORE
1310,SUSHOVAN BASU,Brilliant,5,Nice phoneREAD MORE
1311,Dinesh Kumar,Worth every penny,5,Nice oneREAD MORE
1312,Dr Abhijeet Achari,Mind-blowing purchase,5,Value for moneyREAD MORE
1313,vikrant sharma,Best in the market!,5,"Good product, I can't say something becouse it is Apple phoneREAD MORE"
1314,Mohammed  Arief,Super!,5,SuperbREAD MORE
1315,MD  Faiz Khan,Terrific,5,Awesome ❤️READ MORE
1316,Vamshi Krishna,Just okay,3,Low output amp adopter..READ MORE
1317,akshitha gunupati akshitha gunupati,Fabulous!,5,niceREAD MORE
1318,vivek singh,Mind-blowing purchase,5,Amazing phone i got it after 6sREAD MORE
1319,Rahul Basak,Brilliant,5,It's a great and fastest phone ever but previous price was good with hdfc bank offer but not it's a bit costlier ....So overall u will not regret because it's worth every penny u spend for itREAD MORE
1320,Ashish Shrivastava,Highly recommended,5,Simply great...READ MORE
1321,sanjay Biswas,Excellent,5,Nice mobileREAD MORE
1322,Nirmal Agarwal,Nice product,5,The product was good as expected and nice.READ MORE
1323,ROHAN BISAI,Excellent,5,AwsmmmREAD MORE
1324,Kanwar preet Singh,Simply awesome,5,BEYOND WORDS 👌👌👌READ MORE
1325,Faiyaz  Dhanani ,Worth every penny,5,Very nice phone. Awesome camera.One word. WOW!!!!READ MORE
1326,ANURAG NANDA,Best in the market!,5,Switched to apple after a long time. The phone is built great. A bit bulky (may be due to the Jumbo battery). Otherwise a great purchase.READ MORE
1327,Manoj Kumar,Great product,5,Excellent iPhoneREAD MORE
1328,Aashutosh Goit,Mind-blowing purchase,5,Nice productREAD MORE
1329,Bibhash Kumar  Paul,Fair,3,Phone is good .. flipkart delivery was worst everREAD MORE
1330,Vinod Kumar S,Brilliant,5,Best phone I have ever usedREAD MORE
1331,WASHEF REJA,Just wow!,5,Display need to be improvedREAD MORE
1332,Prashant Choudhary,Worth the money,4,It's a money value phone😊READ MORE
1333,Pankaj Chauhan,Excellent,5,Best for pubgREAD MORE
1334,Adil Abdullah Khan,Wonderful,5,Just go and buy.READ MORE
1335,Moh Sarfaraj,Horrible,5,Worst Flipkart return policy for 1 day only!Disappointed with cameraREAD MORE
1336,9581443000 New42day,Worth every penny,5,Super  phoneBut price is more compare premium android mobilesSatisfied over all    Especially IOS osREAD MORE
1337,Jitendra Wagh,Awesome,4,Dream comes true. Bought Apple product first time. Awesome phone. Delivery on time by Ekart and delivery person is polite.READ MORE
1338,Md. Rafiqul  Alam ,Pretty good,5,Really no phone like iPhone. So switched to iPhone.READ MORE
1339,Anita Chaudhari,Wonderful,4,Best Iphone ever😍😍😍.. Battery is great ..Camera is awesome..READ MORE
1340,Santanu Thapa,Wonderful,5,Worth the price. Premium quality n feeling.READ MORE
1341,Flipkart Customer,Does the job,3,Product is great but 3 star for Flipkart worst exchange policy. Due to these reasons customer is shifting to other platforms.READ MORE
1342,Flipkart Customer,Mind-blowing purchase,5,Great but too expensive 😅READ MORE
1343,Amrit Chandan Patra,Nice product,4,"iPhone 11 is awesome but lacks fast charging within the box.  Good cameras, fast Face ID unlock. Delivery by Flipkart not up to mark. Delayed delivery.READ MORE"
1344,Subir Marjit,Just wow!,5,OkREAD MORE
1345,Vikram Vicky,Classy product,5,I love thisREAD MORE
1346,Muktaz Jahan,Terrific,5,Crazy❤️READ MORE
1347,Manohar  Kumar,Awesome,5,it is awesome. feels good😍😍READ MORE
1348,Flipkart Customer,Wonderful,5,always up for apple go for it.❤️🙏READ MORE
1349,RAHUL ROY,Simply awesome,5,"My first Iphone and the phone is awesome. Irrespective of battery size, easily with one charge I can use for 2days or more. The screen is LCD, but you will not find any difference.READ MORE"
1350,Kinshu Raj,Worth the money,4,The main problem is battery and heating issue. If u play the game the phone will heat so much and the brightness of the phone goes dim automatically. You can't change the hardware settings. But overall phone is very good and the performance is very awesome.READ MORE
1351,Flipkart Customer,Perfect product!,5,GoodREAD MORE
1352,Flipkart Customer,Fabulous!,5,Very fast and awesomeREAD MORE
1353,Shavez Pathan,Value-for-money,4,Nyc mobileREAD MORE
1354,Vivek Kumar,Awesome,5,GoodREAD MORE
1355,Mahesh Garje,Great product,5,Best phone if budget is above 60k !READ MORE
1356,Flipkart Customer,Terrific purchase,5,Super phoneREAD MORE
1357,Navdeep Bansal,Simply awesome,5,Very nice productREAD MORE
1358,utkarsh  singh,Worst experience ever!,5,cheapest product charger is not working in few days bt not chaged by flipkartREAD MORE
1359,Flipkart Customer,Simply awesome,5,#Awsm❤❤READ MORE
1360,Sashanka Pegu,Super!,5,PerfectREAD MORE
1361,Saugata Chowdhury ,Excellent,5,Very good quality product. Received with proper packingREAD MORE
1362,Ravi Jain,Brilliant,5,Great keep it up AppleREAD MORE
1363,Shailendra  Singh,Mind-blowing purchase,5,It is one of the best piece of apple. So far working well. Camera is best out of all phone.READ MORE
1364,Flipkart Customer,Great product,5,Best phone on earth 🌍READ MORE
1365,Sajeena  Begum,Best in the market!,5,Super cool 😍READ MORE
1366,Flipkart Customer,Classy product,5,Nice product worth the moneyREAD MORE
1367,abdul maroof anjum,Mind-blowing purchase,5,Good iphoneREAD MORE
1368,Flipkart Customer,Wonderful,5,Great phone. Prompt delivery by Flipkart.READ MORE
1369,Parag Doshi,Terrific purchase,5,Good ProductREAD MORE
1370,Akula Srinivasu,Highly recommended,5,It’s a good phone its phone is awesome I love Apple phoneREAD MORE
1371,Jatindra Das,Wonderful product,5,"Smooth as Gelato, this handset is truly exceptional. Yes it is costly and will burn a hole, but normally iphones lasts a long time. I have used my last one for 4 years.Display is bigger than iphone 7. The handset fits in hand and is optimally heavy. Premium product.READ MORE"
1372,Shivam  Saurav,Classy product,5,Amazing product. On paper display specs does not do any justice to the quality of display.READ MORE
1373,Yash Raj,Fabulous!,5,Awesome product by apple & thanks flipkart for fast delivery 😍😍READ MORE
1374,Divye Kotwal,Just wow!,5,"As expected, Apple delivered a great product at a good price. This time Apple decided to fill the loopholes left in the earlier series and they didn't disappoint. The delivery by Flipkart was also super fast.READ MORE"
1375,Rushikesh Ingale ,Must buy!,5,Excellent IPhone and packing.READ MORE
1376,Chetan  Mayekar,Wonderful,5,"Best iphone so far..good camera, 5 star for battery , refreshing experienceREAD MORE"
1377,Jasmeet Singh,Must buy!,5,Awsm prdctREAD MORE
1378,Flipkart Customer,Too good,5,Good in all segmentREAD MORE
1379,Jyoti  pundir,Simply awesome,5,it's amazingREAD MORE
1380,Smruti Ranjan  Swain,Don't waste your money,5,Heating problemREAD MORE
1381,Sudipto,Classy product,5,Best iphone in thisREAD MORE
1382,Ramesh Choudhary,Highly recommended,5,Good mobileREAD MORE
1383,Gurmeet singh,Best in the market!,5,awesome phoneREAD MORE
1384,Niraj Kumar,Wonderful,5,Awesome phone good looking working so fastREAD MORE
1385,Naresh kumar,Excellent,5,Awesome mobile I loved it 😍😍😍😍READ MORE
1386,Flipkart Customer,Great product,5,Previous model was betterREAD MORE
1387,Rayyan Merchant,Perfect product!,4,200 Percent Worth!READ MORE
1388,Saksham Bhatt,Worth the money,5,Impressive device good camera best ram management ( pubg specs extreme and hdr ) byt battery life is very poorREAD MORE
1389,Vishnu Karnamkote Sasidharan,Just okay,3,Buy it for the video and photos and not for its display tech(mediocre at best when compared to today's android standards). Buy it for the brand and 4 years of update guarantee !READ MORE
1390,Gampi Bam,Great product,5,Love it!!!READ MORE
1391,Aditya Singh,Brilliant,5,what do you expect...its iphone 11 ...battery portion needs to be improvised.nice phone .READ MORE
1392,Manish Kumar,Just wow!,5,iPhone 11 is the best smartphone of 2020. With great battery life and camera quality.! Go for It..READ MORE
1393,Vijay Kumar Varma,Good quality product,4,good phone... but price is little highREAD MORE
1394,ritesh rajput,Mind-blowing purchase,5,Just awesome simply awesomeREAD MORE
1395,Venkatesh N,Simply awesome,5,"I have been using iPhone 11 since Jan 2020, There some points which I really liked 1. Camera 2. Performances 3. Battery 4. Touch sensitivity Completely outstandingREAD MORE"
1396,RAVNEET SINGH KHAIRA,Awesome,5,A good product with value for moneyREAD MORE
1397,Ravi ranjan Kumar,Brilliant,5,Overall product is very good battery camera sound all are goodREAD MORE
1398,Longkiri Kiling,Worth every penny,5,I love itREAD MORE
1399,Shantam Mittal,Fabulous!,5,I buy this product from Flipkart that is wonderful experience they provide me order within two days  phone is wonderful 🥰🥰🥰READ MORE
1400,Somraj  Basunatary,Wonderful,5,Very great and faster phoneREAD MORE
1401,Hanees  G,Must buy!,5,AwesomeREAD MORE
1402,Franck P,Brilliant,5,excellentREAD MORE
1403,S. Aasif Imam,Excellent,5,"Good product. Camera ,performance is far more better than the previous version.READ MORE"
1404,Manpreet  Kaur,Perfect product!,5,dream i phoneREAD MORE
1405,Boopesh  A,Wonderful,4,Good mobileREAD MORE
1406,Shubham Pandre,Really Nice,4,GoodREAD MORE
1407,Flipkart Customer,Super!,5,Flawless..lit af..😎READ MORE
1408,Parimi Ramkumar,Brilliant,5,Excellent very wellREAD MORE
1409,Jobu Raj,Awesome,5,The best flagshipREAD MORE
1410,Flipkart Customer,Must buy!,5,OutstandingREAD MORE
1411,Ashish  Patil ,Mind-blowing purchase,5,Enjoying with iphone11☺READ MORE
1412,Flipkart Customer,Best in the market!,5,Osm phoneREAD MORE
1413,Mehul Garg ,Awesome,5,Awesome mobileREAD MORE
1414,Yuktesh,Useless product,4,"It’s not a good phone compared to the price , image stabilisation is not good nor is the screenREAD MORE"
1415,amit jaiswal,Worth the money,4,The phone gets heated a lot while using. Rest all other things are okREAD MORE
1416,SUNIL  RAUT,Worth the money,5,GoodREAD MORE
1417,Flipkart Customer,Brilliant,5,Worth for money..!READ MORE
1418,Anirudh Gupta,Terrific purchase,5,Good phone but price bit high 💰READ MORE
1419,Aabshar Pasha,Not recommended at all,5,Phone hang and heat issue in all iphone 11 model almostREAD MORE
1420,Flipkart Customer,Fabulous!,5,It’s a wow experience to use this phone. All the colours are amazing but I choose red.READ MORE
1421,Anil Kumar,Worth every penny,5,FabREAD MORE
1422,Ansuman,Mind-blowing purchase,4,"Brilliant device..Super battery ,brilliant camera.Upgraded from iPhone 7 Plus.Felt like the package was opened & was initially scared but then upon checking the warranty, I was consoled and got some sigh of relief as it wasn't registered.READ MORE"
1423,rahul chaubey,Value-for-money,5,GoodREAD MORE
1424,Prabhat Rituraj,Best in the market!,5,Amazing phone_you will not regret!!!READ MORE
1425,Arshad jamal Ansari,Worth every penny,5,Super coolREAD MORE
1426,Sandeep Ghatge,Terrific,5,No word to say anything of iPhone 11.... Just w😍😍😍😍wREAD MORE
1427,afsal chack,Brilliant,5,niceREAD MORE
1428,Richa Bhartiya,Terrific,5,Great!READ MORE
1429,Amit Kulkarni,Awesome,5,Must BuyI bought this on New Year Day and I must say that this is the best phone ever.READ MORE
1430,Ansuman Tripathy,Mind-blowing purchase,5,AwesomeREAD MORE
1431,Pranav Tripathi,Perfect birthday gift for wife!,5,Purchased as a birthday gift for my wife. Awesome feel and amazing phone.!READ MORE
1432,Anoop K,Value-for-money,4,All good as per the spec. But at times it's getting heat especially from its side buttons edgesREAD MORE
1433,manish kumar,Awesome,5,Worth every single penny😍😍😍🥰🥰READ MORE
1434,Ashish Mahajan,Fabulous!,5,"My first time experience of apple product,Dreams come true.Amazing performance looks like a beast.thanks seller and flipkart ....READ MORE"
1435,vijay gautam,Must buy!,5,A smooth and flagship experience. Value for moneyREAD MORE
1436,Varun Nishad,Excellent,5,We all have one dream to buy iPhone and i am feeling amazed to have this stunning iPhone 11 in my hand everything is best in iPhone 11 no complaints no regrets.READ MORE
1437,Abhra Boral,Simply awesome,5,Worth it! 👌🏻READ MORE
1438,Abhi sharma,Wonderful,5,Superb phoneREAD MORE
1439,Anurag Singh  Patel,Super!,5,GoodREAD MORE
1440,Flipkart Customer,Wonderful,5,Just go for it 👍👍READ MORE
1441,Flipkart Customer,Simply awesome,5,Excellent mobile with good battery back upREAD MORE
1442,sameer malik,Best in the market!,5,Battery life is goodREAD MORE
1443,ASHISH KUMAR SHARMA ,Delightful,4,Only charger issueREAD MORE
1444,Abhishek Singh,Wonderful,5,Best iphone in terms of backup....camera is too goodREAD MORE
1445,Eshwar  Ds ,Phone getting heat,4,phone is getting heat while kept in charging and if we use continuously ... need to check once again if not request you exchange  the sameREAD MORE
1446,Ankur  Makadia,Just wow!,5,Excellent gadget. I will not leave this phone alone as it is so costly! :PREAD MORE
1447,Parmod Kumar Verma,Simply awesome,5,Excellent experienceREAD MORE
1448,Flipkart Customer,Really Nice,4,Nice but price to highREAD MORE
1449,Atul Singh,Just wow!,5,"Awesome phone, and essential upgrade if you have iPhone less than iPhone 8.READ MORE"
1450,Shashidhar Hiremath,Just wow!,5,Awesome phone.READ MORE
1451,Shabeer Ali Mansoor KC,Best in the market!,5,"Best budget iphone in the market with same processor of 11 pro version.Battery is awesome, camera features are good especially night mode.No lag, smooth.. good network connectivity..ios 13 -Incredible purchaseREAD MORE"
1452,Rajesh  Ravaliya,Highly recommended,5,Nice oneREAD MORE
1453,Abu  Talha,Must buy!,5,GoodREAD MORE
1454,Raju Jaiswal,Worth every penny,5,Best thing to buy in the planet.. 😊READ MORE
1455,Anilbabu Ella,Just wow!,5,Apple's iPhone good.. Flipkart aslo delivered a good product I think ..READ MORE
1456,ruchi mittal,Awesome,5,just perfect.READ MORE
1457,Jomdu Dulom,Wonderful,5,Excellent mobileREAD MORE
1458,Flipkart Customer,Worth every penny,5,Valuable productREAD MORE
1459,Mohit Sharma,Must buy!,5,Amezing owsm don’t think go for buyREAD MORE
1460,Bln murthy,Must buy!,5,SuperREAD MORE
1461,yogesh  sharma,Just wow!,5,AwesomeREAD MORE
1462,Vakeel Ahmad,Awesome,5,IphoneREAD MORE
1463,Zaki Rayeen,Terrific purchase,5,Awesome experience ❤️READ MORE
